{
  "schema": "stackia/capacity-router-seed@1",
  "meta": {
    "derived_only": true,
    "source_repo": "Picazo333/stack-ia",
    "source_commit": "6584423e524ca0af3c169bb0a03f9ca03cc7cb12"
  },
  "month": "2026-10",
  "plans": [
    {
      "subscription_id": "chatgpt-plus",
      "subscription_state": "ACTIVE",
      "billing": {
        "currency": "MXN",
        "native_amount": 399,
        "native_certainty": "CONFIRMED",
        "reference_mxn": 399,
        "reference_mxn_certainty": "CONFIRMED"
      },
      "covered_subjects": [
        "chatgpt",
        "codex"
      ]
    },
    {
      "subscription_id": "cursor-pro",
      "subscription_state": "ACTIVE",
      "billing": {
        "currency": "USD",
        "native_amount": 20,
        "native_certainty": "CONFIRMED",
        "reference_mxn": 340,
        "reference_mxn_certainty": "REFERENCE_ESTIMATE"
      },
      "covered_subjects": [
        "cursor"
      ]
    },
    {
      "subscription_id": "google-ai-pro",
      "subscription_state": "ACTIVE",
      "billing": {
        "currency": "MXN",
        "native_amount": 395,
        "native_certainty": "CONFIRMED",
        "reference_mxn": 395,
        "reference_mxn_certainty": "CONFIRMED"
      },
      "covered_subjects": [
        "gemini",
        "google-antigravity",
        "jules",
        "google-ai-studio",
        "notebooklm",
        "google-flow",
        "google-drive"
      ]
    },
    {
      "subscription_id": "capcut-pro",
      "subscription_state": "PENDING_ACTIVATION",
      "billing": {
        "currency": "UNKNOWN",
        "native_amount": null,
        "native_certainty": "UNKNOWN",
        "reference_mxn": null,
        "reference_mxn_certainty": "UNKNOWN"
      },
      "covered_subjects": [
        "capcut"
      ]
    },
    {
      "subscription_id": "higgsfield-current",
      "subscription_state": "ACTIVE",
      "billing": {
        "currency": "UNKNOWN",
        "native_amount": null,
        "native_certainty": "UNKNOWN",
        "reference_mxn": 255,
        "reference_mxn_certainty": "REFERENCE_ESTIMATE"
      },
      "covered_subjects": [
        "higgsfield"
      ]
    },
    {
      "subscription_id": "figma-professional-full",
      "subscription_state": "PENDING_ACTIVATION",
      "billing": {
        "currency": "USD",
        "native_amount": 16,
        "native_certainty": "CONFIRMED",
        "reference_mxn": 276,
        "reference_mxn_certainty": "REFERENCE_ESTIMATE"
      },
      "covered_subjects": [
        "figma"
      ]
    },
    {
      "subscription_id": "canva-free",
      "subscription_state": "FREE",
      "billing": {
        "currency": "USD",
        "native_amount": 0,
        "native_certainty": "CONFIRMED",
        "reference_mxn": null,
        "reference_mxn_certainty": "UNKNOWN"
      },
      "covered_subjects": [
        "canva"
      ]
    },
    {
      "subscription_id": "runway-free",
      "subscription_state": "FREE",
      "billing": {
        "currency": "USD",
        "native_amount": 0,
        "native_certainty": "CONFIRMED",
        "reference_mxn": null,
        "reference_mxn_certainty": "UNKNOWN"
      },
      "covered_subjects": [
        "runway"
      ]
    },
    {
      "subscription_id": "coursera-plus",
      "subscription_state": "PREPAID",
      "billing": {
        "currency": "UNKNOWN",
        "native_amount": null,
        "native_certainty": "UNKNOWN",
        "reference_mxn": null,
        "reference_mxn_certainty": "UNKNOWN"
      },
      "covered_subjects": [
        "coursera"
      ]
    },
    {
      "subscription_id": "nordpass-prepaid",
      "subscription_state": "PREPAID",
      "billing": {
        "currency": "UNKNOWN",
        "native_amount": null,
        "native_certainty": "UNKNOWN",
        "reference_mxn": null,
        "reference_mxn_certainty": "UNKNOWN"
      },
      "covered_subjects": [
        "nordpass"
      ]
    }
  ],
  "capacity_resources": [
    {
      "capacity_resource_id": "chatgpt-plus-chat",
      "plan_ref": "chatgpt-plus",
      "subjects": [
        "chatgpt"
      ],
      "integrations": [],
      "durable_events": {
        "RATE_LIMIT": 0,
        "CAPACITY_EXHAUSTED": 0,
        "PLAN_FEATURE_BLOCKED": 0,
        "SERVICE_UNAVAILABLE": 0
      },
      "depletion_class": "UNKNOWN",
      "scaling_status": "UNASSESSED",
      "reroute_result": "NOT_RUN",
      "economic_gate": "UNASSESSED",
      "next_action": "OBSERVE"
    },
    {
      "capacity_resource_id": "chatgpt-plus-codex",
      "plan_ref": "chatgpt-plus",
      "subjects": [
        "codex"
      ],
      "integrations": [],
      "durable_events": {
        "RATE_LIMIT": 0,
        "CAPACITY_EXHAUSTED": 0,
        "PLAN_FEATURE_BLOCKED": 0,
        "SERVICE_UNAVAILABLE": 0
      },
      "depletion_class": "UNKNOWN",
      "scaling_status": "UNASSESSED",
      "reroute_result": "NOT_RUN",
      "economic_gate": "UNASSESSED",
      "next_action": "OBSERVE"
    },
    {
      "capacity_resource_id": "context7-free-or-current",
      "plan_ref": null,
      "subjects": [
        "context7"
      ],
      "integrations": [
        "context7-mcp"
      ],
      "durable_events": {
        "RATE_LIMIT": 0,
        "CAPACITY_EXHAUSTED": 0,
        "PLAN_FEATURE_BLOCKED": 0,
        "SERVICE_UNAVAILABLE": 0
      },
      "depletion_class": "UNKNOWN",
      "scaling_status": "UNASSESSED",
      "reroute_result": "NOT_RUN",
      "economic_gate": "NOT_REQUIRED",
      "next_action": "OBSERVE"
    },
    {
      "capacity_resource_id": "cursor-pro-agent",
      "plan_ref": "cursor-pro",
      "subjects": [
        "cursor"
      ],
      "integrations": [],
      "durable_events": {
        "RATE_LIMIT": 0,
        "CAPACITY_EXHAUSTED": 0,
        "PLAN_FEATURE_BLOCKED": 0,
        "SERVICE_UNAVAILABLE": 0
      },
      "depletion_class": "UNKNOWN",
      "scaling_status": "UNASSESSED",
      "reroute_result": "NOT_RUN",
      "economic_gate": "UNASSESSED",
      "next_action": "OBSERVE"
    },
    {
      "capacity_resource_id": "figma-professional-full",
      "plan_ref": "figma-professional-full",
      "subjects": [
        "figma"
      ],
      "integrations": [
        "figma-mcp"
      ],
      "durable_events": {
        "RATE_LIMIT": 0,
        "CAPACITY_EXHAUSTED": 0,
        "PLAN_FEATURE_BLOCKED": 0,
        "SERVICE_UNAVAILABLE": 0
      },
      "depletion_class": "UNKNOWN",
      "scaling_status": "UNASSESSED",
      "reroute_result": "NOT_APPLICABLE",
      "economic_gate": "NOT_REQUIRED",
      "next_action": "ACTIVATE_AND_MEASURE"
    },
    {
      "capacity_resource_id": "firecrawl-free-or-current",
      "plan_ref": null,
      "subjects": [
        "firecrawl"
      ],
      "integrations": [
        "firecrawl-mcp",
        "chatgpt-firecrawl"
      ],
      "durable_events": {
        "RATE_LIMIT": 0,
        "CAPACITY_EXHAUSTED": 0,
        "PLAN_FEATURE_BLOCKED": 0,
        "SERVICE_UNAVAILABLE": 0
      },
      "depletion_class": "UNKNOWN",
      "scaling_status": "UNASSESSED",
      "reroute_result": "NOT_RUN",
      "economic_gate": "NOT_REQUIRED",
      "next_action": "OBSERVE_AND_REROUTE_IF_NEEDED"
    },
    {
      "capacity_resource_id": "google-ai-pro-antigravity",
      "plan_ref": "google-ai-pro",
      "subjects": [
        "google-antigravity"
      ],
      "integrations": [],
      "durable_events": {
        "RATE_LIMIT": 0,
        "CAPACITY_EXHAUSTED": 0,
        "PLAN_FEATURE_BLOCKED": 0,
        "SERVICE_UNAVAILABLE": 0
      },
      "depletion_class": "UNKNOWN",
      "scaling_status": "UNASSESSED",
      "reroute_result": "NOT_RUN",
      "economic_gate": "UNASSESSED",
      "next_action": "OBSERVE"
    },
    {
      "capacity_resource_id": "google-ai-pro-flow",
      "plan_ref": "google-ai-pro",
      "subjects": [
        "google-flow"
      ],
      "integrations": [],
      "durable_events": {
        "RATE_LIMIT": 0,
        "CAPACITY_EXHAUSTED": 0,
        "PLAN_FEATURE_BLOCKED": 0,
        "SERVICE_UNAVAILABLE": 0
      },
      "depletion_class": "UNKNOWN",
      "scaling_status": "UNASSESSED",
      "reroute_result": "NOT_RUN",
      "economic_gate": "UNASSESSED",
      "next_action": "BENCHMARK"
    },
    {
      "capacity_resource_id": "google-ai-pro-gemini",
      "plan_ref": "google-ai-pro",
      "subjects": [
        "gemini"
      ],
      "integrations": [],
      "durable_events": {
        "RATE_LIMIT": 0,
        "CAPACITY_EXHAUSTED": 0,
        "PLAN_FEATURE_BLOCKED": 0,
        "SERVICE_UNAVAILABLE": 0
      },
      "depletion_class": "UNKNOWN",
      "scaling_status": "UNASSESSED",
      "reroute_result": "NOT_RUN",
      "economic_gate": "UNASSESSED",
      "next_action": "OBSERVE"
    },
    {
      "capacity_resource_id": "google-ai-pro-jules",
      "plan_ref": "google-ai-pro",
      "subjects": [
        "jules"
      ],
      "integrations": [],
      "durable_events": {
        "RATE_LIMIT": 0,
        "CAPACITY_EXHAUSTED": 0,
        "PLAN_FEATURE_BLOCKED": 0,
        "SERVICE_UNAVAILABLE": 0
      },
      "depletion_class": "UNKNOWN",
      "scaling_status": "UNASSESSED",
      "reroute_result": "NOT_RUN",
      "economic_gate": "UNASSESSED",
      "next_action": "OBSERVE"
    },
    {
      "capacity_resource_id": "higgsfield-current",
      "plan_ref": "higgsfield-current",
      "subjects": [
        "higgsfield"
      ],
      "integrations": [],
      "durable_events": {
        "RATE_LIMIT": 0,
        "CAPACITY_EXHAUSTED": 0,
        "PLAN_FEATURE_BLOCKED": 0,
        "SERVICE_UNAVAILABLE": 0
      },
      "depletion_class": "UNKNOWN",
      "scaling_status": "UNASSESSED",
      "reroute_result": "NOT_RUN",
      "economic_gate": "UNASSESSED",
      "next_action": "BENCHMARK"
    },
    {
      "capacity_resource_id": "runway-free-video",
      "plan_ref": "runway-free",
      "subjects": [
        "runway"
      ],
      "integrations": [
        "chatgpt-runway"
      ],